### ISSUE TITLE
audiobot not connecting to server, api length issue.

### ISSUE THREAD

**Issue by MissXecutioner** [Splamy/TS3AudioBot#937]
**Describe the bug**
Unable to login to ts server due to API constantly requesting bot list...

**Version**
Version:0.12.0
Branch:master
CommitHash:768c186742bff87ea2c13a02f5fe1da5462ceb97

**Platform**
Debian 9.6

.NET Core SDK (reflecting any global.json):
 Version:   3.1.412
 Commit:    751fd182ef

Runtime Environment:
 OS Name:     debian
 OS Version:  10
 OS Platform: Linux
 RID:         debian.10-x64
 Base Path:   /usr/share/dotnet/sdk/3.1.412/

Host (useful for support):
  Version: 5.0.9
  Commit:  208e377a53

.NET SDKs installed:
  3.1.412 [/usr/share/dotnet/sdk]

.NET runtimes installed:
  Microsoft.AspNetCore.App 3.1.18 [/usr/share/dotnet/shared/Microsoft.AspNetCore.App]
  Microsoft.AspNetCore.App 5.0.9 [/usr/share/dotnet/shared/Microsoft.AspNetCore.App]
  Microsoft.NETCore.App 3.1.18 [/usr/share/dotnet/shared/Microsoft.NETCore.App]
  Microsoft.NETCore.App 5.0.9 [/usr/share/dotnet/shared/Microsoft.NETCore.App]

To install additional .NET runtimes or SDKs:
  https://aka.ms/dotnet-download

**Log**
```
2021-08-22 09:29:54.9689| INFO|Core|Setup.LogHeader [============ TS3AudioBot started =============]
2021-08-22 09:29:55.0635| INFO|Core|Setup.LogHeader [ Date: Sunday, 22 August 2021 09:29:55
2021-08-22 09:29:55.2248| INFO|Core|Setup.LogHeader [ Version: 0.12.0/master/768c1867
2021-08-22 09:29:55.2248| INFO|Core|Setup.LogHeader [ Build: Release
2021-08-22 09:29:55.2248| INFO|Core|Setup.LogHeader [ Platform: Debian GNU/Linux 10 (buster) (64bit)
2021-08-22 09:29:55.2248| INFO|Core|Setup.LogHeader [ Runtime: .NET Framework 3.1.13 ServerGC:False GC:SustainedLowLatency
2021-08-22 09:29:55.2248| INFO|Core|Setup.LogHeader [ Opus: libopus 1.3 (x64)
2021-08-22 09:29:55.2248| INFO|Core|Setup.LogHeader [==============================================]
2021-08-22 09:29:56.0572| WARN|Core|WebServer.StartWebServer The api is required for the webinterface to work properly; The api is now implicitly enabled. Enable the api in the config to remove this warning.
2021-08-22 09:29:56.0803| INFO|Core|WebServer.StartWebServerInternal Starting Webserver on port 9063
2021-08-22 09:29:56.4217| INFO|Core|Bot.Run Bot "default" connecting to "45.141.57.92:9991"
2021-08-22 09:30:24.5640| INFO|Api|WebApi.ProcessApiV1Call ::ffff:185.188.131.223 Requested: /api/json/merge
2021-08-22 09:30:25.3090| INFO|Api|WebApi.ProcessApiV1Call ::ffff:185.188.131.223 Requested: /api/version
2021-08-22 09:30:26.2781| INFO|Api|WebApi.ProcessApiV1Call ::ffff:185.188.131.223 Requested: /api/system/info
2021-08-22 09:30:27.0685| INFO|0|Ts3Client.TryReconnect Trying to reconnect because of Timeout. Delaying reconnect for 1 seconds
2021-08-22 09:30:27.2753| INFO|Api|WebApi.ProcessApiV1Call ::ffff:185.188.131.223 Requested: /api/system/info
2021-08-22 09:30:28.2789| INFO|Api|WebApi.ProcessApiV1Call ::ffff:185.188.131.223 Requested: /api/system/info
2021-08-22 09:30:29.2794| INFO|Api|WebApi.ProcessApiV1Call ::ffff:185.188.131.223 Requested: /api/system/info
2021-08-22 09:30:30.5799| INFO|Api|WebApi.ProcessApiV1Call ::ffff:185.188.131.223 Requested: /api/system/info
2021-08-22 09:30:31.5700| INFO|Api|WebApi.ProcessApiV1Call ::ffff:185.188.131.223 Requested: /api/system/info
2021-08-22 09:30:32.5528| INFO|Api|WebApi.ProcessApiV1Call ::ffff:185.188.131.223 Requested: /api/system/info
2021-08-22 09:30:33.5613| INFO|Api|WebApi.ProcessApiV1Call ::ffff:185.188.131.223 Requested: /api/system/info
2021-08-22 09:30:34.5553| INFO|Api|WebApi.ProcessApiV1Call ::ffff:185.188.131.223 Requested: /api/system/info
2021-08-22 09:30:35.5571| INFO|Api|WebApi.ProcessApiV1Call ::ffff:185.188.131.223 Requested: /api/system/info
2021-08-22 09:30:36.5611| INFO|Api|WebApi.ProcessApiV1Call ::ffff:185.188.131.223 Requested: /api/system/info
2021-08-22 09:30:37.5571| INFO|Api|WebApi.ProcessApiV1Call ::ffff:185.188.131.223 Requested: /api/system/info
2021-08-22 09:30:38.5680| INFO|Api|WebApi.ProcessApiV1Call ::ffff:185.188.131.223 Requested: /api/system/info
2021-08-22 09:30:39.5622| INFO|Api|WebApi.ProcessApiV1Call ::ffff:185.188.131.223 Requested: /api/system/info
2021-08-22 09:30:40.5581| INFO|Api|WebApi.ProcessApiV1Call ::ffff:185.188.131.223 Requested: /api/system/info
2021-08-22 09:30:41.5492| INFO|Api|WebApi.ProcessApiV1Call ::ffff:185.188.131.223 Requested: /api/system/info
2021-08-22 09:30:42.5527| INFO|Api|WebApi.ProcessApiV1Call ::ffff:185.188.131.223 Requested: /api/system/info
2021-08-22 09:30:43.5604| INFO|Api|WebApi.ProcessApiV1Call ::ffff:185.188.131.223 Requested: /api/system/info
2021-08-22 09:30:44.5546| INFO|Api|WebApi.ProcessApiV1Call ::ffff:185.188.131.223 Requested: /api/system/info
2021-08-22 09:30:45.5460| INFO|Api|WebApi.ProcessApiV1Call ::ffff:185.188.131.223 Requested: /api/system/info
2021-08-22 09:30:46.5486| INFO|Api|WebApi.ProcessApiV1Call ::ffff:185.188.131.223 Requested: /api/system/info
2021-08-22 09:30:47.5686| INFO|Api|WebApi.ProcessApiV1Call ::ffff:185.188.131.223 Requested: /api/system/info
2021-08-22 09:30:48.5500| INFO|Api|WebApi.ProcessApiV1Call ::ffff:185.188.131.223 Requested: /api/system/info
2021-08-22 09:30:49.5625| INFO|Api|WebApi.ProcessApiV1Call ::ffff:185.188.131.223 Requested: /api/system/info
2021-08-22 09:30:50.5447| INFO|Api|WebApi.ProcessApiV1Call ::ffff:185.188.131.223 Requested: /api/system/info
2021-08-22 09:30:51.5485| INFO|Api|WebApi.ProcessApiV1Call ::ffff:185.188.131.223 Requested: /api/system/info
2021-08-22 09:30:52.5503| INFO|Api|WebApi.ProcessApiV1Call ::ffff:185.188.131.223 Requested: /api/system/info
2021-08-22 09:30:53.5994| INFO|Api|WebApi.ProcessApiV1Call ::ffff:185.188.131.223 Requested: /api/system/info
2021-08-22 09:30:54.5578| INFO|Api|WebApi.ProcessApiV1Call ::ffff:185.188.131.223 Requested: /api/system/info
2021-08-22 09:30:55.5630| INFO|Api|WebApi.ProcessApiV1Call ::ffff:185.188.131.223 Requested: /api/system/info
2021-08-22 09:30:56.5594| INFO|Api|WebApi.ProcessApiV1Call ::ffff:185.188.131.223 Requested: /api/system/info
2021-08-22 09:30:57.5592| INFO|Api|WebApi.ProcessApiV1Call ::ffff:185.188.131.223 Requested: /api/system/info
2021-08-22 09:30:58.2800| INFO|0|Ts3Client.TryReconnect Trying to reconnect because of Timeout. Delaying reconnect for 2 seconds
2021-08-22 09:30:58.5585| INFO|Api|WebApi.ProcessApiV1Call ::ffff:185.188.131.223 Requested: /api/system/info
2021-08-22 09:30:59.5527| INFO|Api|WebApi.ProcessApiV1Call ::ffff:185.188.131.223 Requested: /api/system/info
2021-08-22 09:31:00.5530| INFO|Api|WebApi.ProcessApiV1Call ::ffff:185.188.131.223 Requested: /api/system/info
2021-08-22 09:31:01.5580| INFO|Api|WebApi.ProcessApiV1Call ::ffff:185.188.131.223 Requested: /api/system/info
2021-08-22 09:31:02.5650| INFO|Api|WebApi.ProcessApiV1Call ::ffff:185.188.131.223 Requested: /api/system/info
2021-08-22 09:31:03.5514| INFO|Api|WebApi.ProcessApiV1Call ::ffff:185.188.131.223 Requested: /api/system/info
2021-08-22 09:31:04.5525| INFO|Api|WebApi.ProcessApiV1Call ::ffff:185.188.131.223 Requested: /api/system/info
2021-08-22 09:31:05.5609| INFO|Api|WebApi.ProcessApiV1Call ::ffff:185.188.131.223 Requested: /api/system/info
2021-08-22 09:31:06.5474| INFO|Api|WebApi.ProcessApiV1Call ::ffff:185.188.131.223 Requested: /api/system/info
2021-08-22 09:31:07.5567| INFO|Api|WebApi.ProcessApiV1Call ::ffff:185.188.131.223 Requested: /api/system/info
2021-08-22 09:31:08.5510| INFO|Api|WebApi.ProcessApiV1Call ::ffff:185.188.131.223 Requested: /api/system/info
2021-08-22 09:31:09.5515| INFO|Api|WebApi.ProcessApiV1Call ::ffff:185.188.131.223 Requested: /api/system/info
2021-08-22 09:31:10.5531| INFO|Api|WebApi.ProcessApiV1Call ::ffff:185.188.131.223 Requested: /api/system/info
2021-08-22 09:31:11.5579| INFO|Api|WebApi.ProcessApiV1Call ::ffff:185.188.131.223 Requested: /api/system/info
2021-08-22 09:31:12.5605| INFO|Api|WebApi.ProcessApiV1Call ::ffff:185.188.131.223 Requested: /api/system/info
2021-08-22 09:31:13.5593| INFO|Api|WebApi.ProcessApiV1Call ::ffff:185.188.131.223 Requested: /api/system/info
2021-08-22 09:31:14.5615| INFO|Api|WebApi.ProcessApiV1Call ::ffff:185.188.131.223 Requested: /api/system/info
2021-08-22 09:31:15.5505| INFO|Api|WebApi.ProcessApiV1Call ::ffff:185.188.131.223 Requested: /api/system/info
2021-08-22 09:31:16.5602| INFO|Api|WebApi.ProcessApiV1Call ::ffff:185.188.131.223 Requested: /api/system/info
2021-08-22 09:31:17.5594| INFO|Api|WebApi.ProcessApiV1Call ::ffff:185.188.131.223 Requested: /api/system/info
2021-08-22 09:31:18.5635| INFO|Api|WebApi.ProcessApiV1Call ::ffff:185.188.131.223 Requested: /api/system/info
2021-08-22 09:31:19.5537| INFO|Api|WebApi.ProcessApiV1Call ::ffff:185.188.131.223 Requested: /api/system/info
2021-08-22 09:31:20.5587| INFO|Api|WebApi.ProcessApiV1Call ::ffff:185.188.131.223 Requested: /api/system/info
2021-08-22 09:31:21.5627| INFO|Api|WebApi.ProcessApiV1Call ::ffff:185.188.131.223 Requested: /api/system/info
2021-08-22 09:31:22.5461| INFO|Api|WebApi.ProcessApiV1Call ::ffff:185.188.131.223 Requested: /api/system/info
2021-08-22 09:31:23.5595| INFO|Api|WebApi.ProcessApiV1Call ::ffff:185.188.131.223 Requested: /api/system/info
2021-08-22 09:31:24.5606| INFO|Api|WebApi.ProcessApiV1Call ::ffff:185.188.131.223 Requested: /api/system/info
2021-08-22 09:31:25.5670| INFO|Api|WebApi.ProcessApiV1Call ::ffff:185.188.131.223 Requested: /api/system/info
2021-08-22 09:31:26.5507| INFO|Api|WebApi.ProcessApiV1Call ::ffff:185.188.131.223 Requested: /api/system/info
2021-08-22 09:31:27.5475| INFO|Api|WebApi.ProcessApiV1Call ::ffff:185.188.131.223 Requested: /api/system/info
2021-08-22 09:31:28.5520| INFO|Api|WebApi.ProcessApiV1Call ::ffff:185.188.131.223 Requested: /api/system/info
2021-08-22 09:31:29.5595| INFO|Api|WebApi.ProcessApiV1Call ::ffff:185.188.131.223 Requested: /api/system/info
2021-08-22 09:31:30.4906| INFO|0|Ts3Client.TryReconnect Trying to reconnect because of Timeout. Delaying reconnect for 5 seconds
2021-08-22 09:31:30.5607| INFO|Api|WebApi.ProcessApiV1Call ::ffff:185.188.131.223 Requested: /api/system/info
2021-08-22 09:31:31.5591| INFO|Api|WebApi.ProcessApiV1Call ::ffff:185.188.131.223 Requested: /api/system/info
2021-08-22 09:31:32.5515| INFO|Api|WebApi.ProcessApiV1Call ::ffff:185.188.131.223 Requested: /api/system/info
2021-08-22 09:31:33.5573| INFO|Api|WebApi.ProcessApiV1Call ::ffff:185.188.131.223 Requested: /api/system/info
2021-08-22 09:31:34.5498| INFO|Api|WebApi.ProcessApiV1Call ::ffff:185.188.131.223 Requested: /api/system/info
2021-08-22 09:31:35.5497| INFO|Api|WebApi.ProcessApiV1Call ::ffff:185.188.131.223 Requested: /api/system/info
2021-08-22 09:31:36.5485| INFO|Api|WebApi.ProcessApiV1Call ::ffff:185.188.131.223 Requested: /api/system/info
2021-08-22 09:31:37.5590| INFO|Api|WebApi.ProcessApiV1Call ::ffff:185.188.131.223 Requested: /api/system/info
2021-08-22 09:31:38.5607| INFO|Api|WebApi.ProcessApiV1Call ::ffff:185.188.131.223 Requested: /api/system/info
2021-08-22 09:31:39.5454| INFO|Api|WebApi.ProcessApiV1Call ::ffff:185.188.131.223 Requested: /api/system/info
2021-08-22 09:31:40.5500| INFO|Api|WebApi.ProcessApiV1Call ::ffff:185.188.131.223 Requested: /api/system/info
2021-08-22 09:31:41.5526| INFO|Api|WebApi.ProcessApiV1Call ::ffff:185.188.131.223 Requested: /api/system/info
2021-08-22 09:31:42.5681| INFO|Api|WebApi.ProcessApiV1Call ::ffff:185.188.131.223 Requested: /api/system/info
2021-08-22 09:31:43.5577| INFO|Api|WebApi.ProcessApiV1Call ::ffff:185.188.131.223 Requested: /api/system/info
2021-08-22 09:31:44.5622| INFO|Api|WebApi.ProcessApiV1Call ::ffff:185.188.131.223 Requested: /api/system/info
2021-08-22 09:31:45.5583| INFO|Api|WebApi.ProcessApiV1Call ::ffff:185.188.131.223 Requested: /api/system/info
2021-08-22 09:31:46.5648| INFO|Api|WebApi.ProcessApiV1Call ::ffff:185.188.131.223 Requested: /api/system/info
2021-08-22 09:31:47.5498| INFO|Api|WebApi.ProcessApiV1Call ::ffff:185.188.131.223 Requested: /api/system/info
2021-08-22 09:31:48.5618| INFO|Api|WebApi.ProcessApiV1Call ::ffff:185.188.131.223 Requested: /api/system/info
2021-08-22 09:31:49.5618| INFO|Api|WebApi.ProcessApiV1Call ::ffff:185.188.131.223 Requested: /api/system/info
2021-08-22 09:31:50.5555| INFO|Api|WebApi.ProcessApiV1Call ::ffff:185.188.131.223 Requested: /api/system/info
2021-08-22 09:31:51.5557| INFO|Api|WebApi.ProcessApiV1Call ::ffff:185.188.131.223 Requested: /api/system/info
2021-08-22 09:31:52.5608| INFO|Api|WebApi.ProcessApiV1Call ::ffff:185.188.131.223 Requested: /api/system/info
2021-08-22 09:31:53.5646| INFO|Api|WebApi.ProcessApiV1Call ::ffff:185.188.131.223 Requested: /api/system/info
2021-08-22 09:31:54.5639| INFO|Api|WebApi.ProcessApiV1Call ::ffff:185.188.131.223 Requested: /api/system/info
2021-08-22 09:31:55.5566| INFO|Api|WebApi.ProcessApiV1Call ::ffff:185.188.131.223 Requested: /api/system/info
2021-08-22 09:31:56.5595| INFO|Api|WebApi.ProcessApiV1Call ::ffff:185.188.131.223 Requested: /api/system/info
2021-08-22 09:31:57.5526| INFO|Api|WebApi.ProcessApiV1Call ::ffff:185.188.131.223 Requested: /api/system/info
2021-08-22 09:31:58.5569| INFO|Api|WebApi.ProcessApiV1Call ::ffff:185.188.131.223 Requested: /api/system/info
2021-08-22 09:31:59.5539| INFO|Api|WebApi.ProcessApiV1Call ::ffff:185.188.131.223 Requested: /api/system/info
2021-08-22 09:32:00.5475| INFO|Api|WebApi.ProcessApiV1Call ::ffff:185.188.131.223 Requested: /api/system/info
2021-08-22 09:32:01.5588| INFO|Api|WebApi.ProcessApiV1Call ::ffff:185.188.131.223 Requested: /api/system/info
2021-08-22 09:32:02.5582| INFO|Api|WebApi.ProcessApiV1Call ::ffff:185.188.131.223 Requested: /api/system/info
2021-08-22 09:32:03.5593| INFO|Api|WebApi.ProcessApiV1Call ::ffff:185.188.131.223 Requested: /api/system/info
2021-08-22 09:32:04.5583| INFO|Api|WebApi.ProcessApiV1Call ::ffff:185.188.131.223 Requested: /api/system/info
2021-08-22 09:32:05.5615| INFO|Api|WebApi.ProcessApiV1Call ::ffff:185.188.131.223 Requested: /api/system/info
2021-08-22 09:32:05.7036| INFO|0|Ts3Client.TryReconnect Trying to reconnect because of Timeout. Delaying reconnect for 10 seconds
2021-08-22 09:32:06.5793| INFO|Api|WebApi.ProcessApiV1Call ::ffff:185.188.131.223 Requested: /api/system/info
2021-08-22 09:32:07.5782| INFO|Api|WebApi.ProcessApiV1Call ::ffff:185.188.131.223 Requested: /api/system/info
2021-08-22 09:32:08.5517| INFO|Api|WebApi.ProcessApiV1Call ::ffff:185.188.131.223 Requested: /api/system/info
2021-08-22 09:32:09.5518| INFO|Api|WebApi.ProcessApiV1Call ::ffff:185.188.131.223 Requested: /api/system/info
2021-08-22 09:32:10.5575| INFO|Api|WebApi.ProcessApiV1Call ::ffff:185.188.131.223 Requested: /api/system/info
2021-08-22 09:32:11.5578| INFO|Api|WebApi.ProcessApiV1Call ::ffff:185.188.131.223 Requested: /api/system/info
2021-08-22 09:32:12.5569| INFO|Api|WebApi.ProcessApiV1Call ::ffff:185.188.131.223 Requested: /api/system/info
2021-08-22 09:32:13.5561| INFO|Api|WebApi.ProcessApiV1Call ::ffff:185.188.131.223 Requested: /api/system/info
2021-08-22 09:32:14.5580| INFO|Api|WebApi.ProcessApiV1Call ::ffff:185.188.131.223 Requested: /api/system/info
2021-08-22 09:32:15.5447| INFO|Api|WebApi.ProcessApiV1Call ::ffff:185.188.131.223 Requested: /api/system/info
2021-08-22 09:32:16.5593| INFO|Api|WebApi.ProcessApiV1Call ::ffff:185.188.131.223 Requested: /api/system/info
2021-08-22 09:32:17.5511| INFO|Api|WebApi.ProcessApiV1Call ::ffff:185.188.131.223 Requested: /api/system/info
2021-08-22 09:32:18.5517| INFO|Api|WebApi.ProcessApiV1Call ::ffff:185.188.131.223 Requested: /api/system/info
2021-08-22 09:32:19.5601| INFO|Api|WebApi.ProcessApiV1Call ::ffff:185.188.131.223 Requested: /api/system/info
2021-08-22 09:32:20.5509| INFO|Api|WebApi.ProcessApiV1Call ::ffff:185.188.131.223 Requested: /api/system/info
2021-08-22 09:32:21.5612| INFO|Api|WebApi.ProcessApiV1Call ::ffff:185.188.131.223 Requested: /api/system/info
2021-08-22 09:32:22.5443| INFO|Api|WebApi.ProcessApiV1Call ::ffff:185.188.131.223 Requested: /api/system/info
2021-08-22 09:32:23.5551| INFO|Api|WebApi.ProcessApiV1Call ::ffff:185.188.131.223 Requested: /api/system/info
2021-08-22 09:32:24.5555| INFO|Api|WebApi.ProcessApiV1Call ::ffff:185.188.131.223 Requested: /api/system/info
2021-08-22 09:32:25.5643| INFO|Api|WebApi.ProcessApiV1Call ::ffff:185.188.131.223 Requested: /api/system/info
2021-08-22 09:32:26.5471| INFO|Api|WebApi.ProcessApiV1Call ::ffff:185.188.131.223 Requested: /api/system/info
2021-08-22 09:32:27.5651| INFO|Api|WebApi.ProcessApiV1Call ::ffff:185.188.131.223 Requested: /api/system/info
2021-08-22 09:32:28.5555| INFO|Api|WebApi.ProcessApiV1Call ::ffff:185.188.131.223 Requested: /api/system/info
2021-08-22 09:32:29.5576| INFO|Api|WebApi.ProcessApiV1Call ::ffff:185.188.131.223 Requested: /api/system/info
2021-08-22 09:32:30.5649| INFO|Api|WebApi.ProcessApiV1Call ::ffff:185.188.131.223 Requested: /api/system/info
2021-08-22 09:32:31.5531| INFO|Api|WebApi.ProcessApiV1Call ::ffff:185.188.131.223 Requested: /api/system/info
2021-08-22 09:32:32.5472| INFO|Api|WebApi.ProcessApiV1Call ::ffff:185.188.131.223 Requested: /api/system/info
2021-08-22 09:32:33.5653| INFO|Api|WebApi.ProcessApiV1Call ::ffff:185.188.131.223 Requested: /api/system/info
2021-08-22 09:32:34.5624| INFO|Api|WebApi.ProcessApiV1Call ::ffff:185.188.131.223 Requested: /api/system/info
2021-08-22 09:32:35.5448| INFO|Api|WebApi.ProcessApiV1Call ::ffff:185.188.131.223 Requested: /api/system/info
2021-08-22 09:32:36.5535| INFO|Api|WebApi.ProcessApiV1Call ::ffff:185.188.131.223 Requested: /api/system/info
2021-08-22 09:32:37.5637| INFO|Api|WebApi.ProcessApiV1Call ::ffff:185.188.131.223 Requested: /api/system/info
2021-08-22 09:32:38.5517| INFO|Api|WebApi.ProcessApiV1Call ::ffff:185.188.131.223 Requested: /api/system/info
2021-08-22 09:32:39.5576| INFO|Api|WebApi.ProcessApiV1Call ::ffff:185.188.131.223 Requested: /api/system/info
2021-08-22 09:32:40.5449| INFO|Api|WebApi.ProcessApiV1Call ::ffff:185.188.131.223 Requested: /api/system/info
2021-08-22 09:32:41.5439| INFO|Api|WebApi.ProcessApiV1Call ::ffff:185.188.131.223 Requested: /api/system/info
2021-08-22 09:32:42.5597| INFO|Api|WebApi.ProcessApiV1Call ::ffff:185.188.131.223 Requested: /api/system/info
2021-08-22 09:32:43.5468| INFO|Api|WebApi.ProcessApiV1Call ::ffff:185.188.131.223 Requested: /api/system/info
2021-08-22 09:32:44.5543| INFO|Api|WebApi.ProcessApiV1Call ::ffff:185.188.131.223 Requested: /api/system/info
2021-08-22 09:32:45.5477| INFO|Api|WebApi.ProcessApiV1Call ::ffff:185.188.131.223 Requested: /api/system/info
2021-08-22 09:32:45.9154| INFO|0|Ts3Client.TryReconnect Trying to reconnect because of Timeout. Delaying reconnect for 30 seconds
2021-08-22 09:32:46.5519| INFO|Api|WebApi.ProcessApiV1Call ::ffff:185.188.131.223 Requested: /api/system/info
2021-08-22 09:32:47.5590| INFO|Api|WebApi.ProcessApiV1Call ::ffff:185.188.131.223 Requested: /api/system/info
2021-08-22 09:32:48.5591| INFO|Api|WebApi.ProcessApiV1Call ::ffff:185.188.131.223 Requested: /api/system/info
2021-08-22 09:32:49.5585| INFO|Api|WebApi.ProcessApiV1Call ::ffff:185.188.131.223 Requested: /api/system/info
2021-08-22 09:32:50.5523| INFO|Api|WebApi.ProcessApiV1Call ::ffff:185.188.131.223 Requested: /api/system/info
2021-08-22 09:32:51.5514| INFO|Api|WebApi.ProcessApiV1Call ::ffff:185.188.131.223 Requested: /api/system/info
2021-08-22 09:32:52.5546| INFO|Api|WebApi.ProcessApiV1Call ::ffff:185.188.131.223 Requested: /api/system/info
2021-08-22 09:32:53.5565| INFO|Api|WebApi.ProcessApiV1Call ::ffff:185.188.131.223 Requested: /api/system/info
2021-08-22 09:32:54.5582| INFO|Api|WebApi.ProcessApiV1Call ::ffff:185.188.131.223 Requested: /api/system/info
2021-08-22 09:32:55.5647| INFO|Api|WebApi.ProcessApiV1Call ::ffff:185.188.131.223 Requested: /api/system/info
2021-08-22 09:32:56.5688| INFO|Api|WebApi.ProcessApiV1Call ::ffff:185.188.131.223 Requested: /api/system/info
2021-08-22 09:32:57.5609| INFO|Api|WebApi.ProcessApiV1Call ::ffff:185.188.131.223 Requested: /api/system/info
2021-08-22 09:32:58.5460| INFO|Api|WebApi.ProcessApiV1Call ::ffff:185.188.131.223 Requested: /api/system/info
2021-08-22 09:32:59.5473| INFO|Api|WebApi.ProcessApiV1Call ::ffff:185.188.131.223 Requested: /api/system/info
2021-08-22 09:33:00.2740| INFO|Api|WebApi.ProcessApiV1Call ::ffff:185.188.131.223 Requested: /api/system/info
2021-08-22 09:33:01.2714| INFO|Api|WebApi.ProcessApiV1Call ::ffff:185.188.131.223 Requested: /api/system/info
2021-08-22 09:33:01.5052| INFO|Api|WebApi.ProcessApiV1Call ::ffff:185.188.131.223 Requested: /api/bot/list
2021-08-22 09:33:02.4543| INFO|Api|WebApi.ProcessApiV1Call ::ffff:185.188.131.223 Requested: /api/bot/use/0/(/bot/disconnect)
2021-08-22 09:33:02.4617| INFO|Api|Bot.Stop Bot (0) disconnecting.
2021-08-22 09:33:02.5328| INFO|Api|WebApi.ProcessApiV1Call ::ffff:185.188.131.223 Requested: /api/bot/list
2021-08-22 09:33:07.0457| INFO|Api|WebApi.ProcessApiV1Call ::ffff:185.188.131.223 Requested: /api/bot/connect/template/default
2021-08-22 09:33:07.0587| INFO|Api|Bot.Run Bot "default" connecting to "45.141.57.92:9991"
2021-08-22 09:33:07.0983| INFO|Api|WebApi.ProcessApiV1Call ::ffff:185.188.131.223 Requested: /api/bot/list
2021-08-22 09:33:08.5606| INFO|Api|WebApi.ProcessApiV1Call ::ffff:185.188.131.223 Requested: /api/bot/list
2021-08-22 09:33:09.5538| INFO|Api|WebApi.ProcessApiV1Call ::ffff:185.188.131.223 Requested: /api/bot/list
2021-08-22 09:33:10.3086| INFO|Api|WebApi.ProcessApiV1Call ::ffff:185.188.131.223 Requested: /api/bot/list
2021-08-22 09:33:11.5592| INFO|Api|WebApi.ProcessApiV1Call ::ffff:185.188.131.223 Requested: /api/bot/list
2021-08-22 09:33:12.5566| INFO|Api|WebApi.ProcessApiV1Call ::ffff:185.188.131.223 Requested: /api/bot/list
2021-08-22 09:33:13.1360| INFO|Api|WebApi.ProcessApiV1Call ::ffff:185.188.131.223 Requested: /api/bot/list
2021-08-22 09:33:14.1344| INFO|Api|WebApi.ProcessApiV1Call ::ffff:185.188.131.223 Requested: /api/bot/list
2021-08-22 09:33:15.5477| INFO|Api|WebApi.ProcessApiV1Call ::ffff:185.188.131.223 Requested: /api/bot/list
2021-08-22 09:33:16.5532| INFO|Api|WebApi.ProcessApiV1Call ::ffff:185.188.131.223 Requested: /api/bot/list
2021-08-22 09:33:17.5605| INFO|Api|WebApi.ProcessApiV1Call ::ffff:185.188.131.223 Requested: /api/bot/list
2021-08-22 09:33:18.5523| INFO|Api|WebApi.ProcessApiV1Call ::ffff:185.188.131.223 Requested: /api/bot/list
2021-08-22 09:33:19.5662| INFO|Api|WebApi.ProcessApiV1Call ::ffff:185.188.131.223 Requested: /api/bot/list
2021-08-22 09:33:20.5514| INFO|Api|WebApi.ProcessApiV1Call ::ffff:185.188.131.223 Requested: /api/bot/list
2021-08-22 09:33:21.5604| INFO|Api|WebApi.ProcessApiV1Call ::ffff:185.188.131.223 Requested: /api/bot/list
2021-08-22 09:33:22.5521| INFO|Api|WebApi.ProcessApiV1Call ::ffff:185.188.131.223 Requested: /api/bot/list
2021-08-22 09:33:23.5480| INFO|Api|WebApi.ProcessApiV1Call ::ffff:185.188.131.223 Requested: /api/bot/list
2021-08-22 09:33:24.5542| INFO|Api|WebApi.ProcessApiV1Call ::ffff:185.188.131.223 Requested: /api/bot/list
2021-08-22 09:33:25.5507| INFO|Api|WebApi.ProcessApiV1Call ::ffff:185.188.131.223 Requested: /api/bot/list
2021-08-22 09:33:26.5544| INFO|Api|WebApi.ProcessApiV1Call ::ffff:185.188.131.223 Requested: /api/bot/list
2021-08-22 09:33:27.5540| INFO|Api|WebApi.ProcessApiV1Call ::ffff:185.188.131.223 Requested: /api/bot/list
2021-08-22 09:33:28.5595| INFO|Api|WebApi.ProcessApiV1Call ::ffff:185.188.131.223 Requested: /api/bot/list
2021-08-22 09:33:29.5469| INFO|Api|WebApi.ProcessApiV1Call ::ffff:185.188.131.223 Requested: /api/bot/list
2021-08-22 09:33:30.5551| INFO|Api|WebApi.ProcessApiV1Call ::ffff:185.188.131.223 Requested: /api/bot/list
2021-08-22 09:33:31.5560| INFO|Api|WebApi.ProcessApiV1Call ::ffff:185.188.131.223 Requested: /api/bot/list
2021-08-22 09:33:32.5525| INFO|Api|WebApi.ProcessApiV1Call ::ffff:185.188.131.223 Requested: /api/bot/list
2021-08-22 09:33:33.5517| INFO|Api|WebApi.ProcessApiV1Call ::ffff:185.188.131.223 Requested: /api/bot/list
2021-08-22 09:33:34.5630| INFO|Api|WebApi.ProcessApiV1Call ::ffff:185.188.131.223 Requested: /api/bot/list
2021-08-22 09:33:35.5514| INFO|Api|WebApi.ProcessApiV1Call ::ffff:185.188.131.223 Requested: /api/bot/list
2021-08-22 09:33:36.5445| INFO|Api|WebApi.ProcessApiV1Call ::ffff:185.188.131.223 Requested: /api/bot/list
2021-08-22 09:33:37.2692| INFO|0|Ts3Client.TryReconnect Trying to reconnect because of Timeout. Delaying reconnect for 1 seconds
2021-08-22 09:33:37.5590| INFO|Api|WebApi.ProcessApiV1Call ::ffff:185.188.131.223 Requested: /api/bot/list
2021-08-22 09:33:38.5462| INFO|Api|WebApi.ProcessApiV1Call ::ffff:185.188.131.223 Requested: /api/bot/list
2021-08-22 09:33:39.5614| INFO|Api|WebApi.ProcessApiV1Call ::ffff:185.188.131.223 Requested: /api/bot/list
2021-08-22 09:33:40.5479| INFO|Api|WebApi.ProcessApiV1Call ::ffff:185.188.131.223 Requested: /api/bot/list
2021-08-22 09:33:41.5471| INFO|Api|WebApi.ProcessApiV1Call ::ffff:185.188.131.223 Requested: /api/bot/list
2021-08-22 09:33:42.5581| INFO|Api|WebApi.ProcessApiV1Call ::ffff:185.188.131.223 Requested: /api/bot/list
```

**Comment by MissXecutioner** [comment]
listening on eth0, link-type EN10MB (Ethernet), capture size 262144 bytes
15:23:09.976894 IP xxx.xxx.xxx.xx.60189 > 45.141.57.92.9991: UDP, length 34
15:23:09.977686 IP 45.141.57.92.9991 >xxx.xxx.xxx.xx.60189: UDP, length 32
15:23:10.046624 IP xxx.xxx.xxx.xx.60189 > 45.141.57.92.9991: UDP, length 38
15:23:10.047050 IP 45.141.57.92.9991 > xxx.xxx.xxx.xx.60189: UDP, length 244
"^C
4 packets captured
4 packets received by filter
0 packets dropped by kernel

**Comment by MissXecutioner** [comment]
up

**Comment by Flakebi** [comment]
From, the log, it looks like the server is not responding anymore.
A `Trace` log should contain more info about which packets are sent and received and where it stops working. Here are instructions to increase the log level: https://github.com/Splamy/TS3AudioBot/wiki/Troubleshooting

Sidenote: The `Requested: /api/bot/list` log lines are unrelated to the timeout, they’re probably there because someone opened the webinterface.

**Comment by MissXecutioner** [comment]
I think you've done something, the bot is logging into the ts server right now.

**Comment by MissXecutioner** [comment]
and it doesn't login again, it logs into other ts servers but not my own ts server. I contacted hosting and was told there was no problem with the ip.

**Comment by MissXecutioner** [comment]
![image](https://user-images.githubusercontent.com/73059032/131387297-7d26c8f3-592f-4369-aad3-cd8255229ad3.png)

**Comment by MissXecutioner** [comment]
![image](https://user-images.githubusercontent.com/73059032/131387496-a077281f-4e0a-43d2-b258-01defd8bb1bc.png)
![image](https://user-images.githubusercontent.com/73059032/131387515-a60e3d9b-6814-4cab-9e25-5ab52ef288e4.png)

**Comment by MissXecutioner** [comment]
Data: 5D 65 36 30 00 61 2D 25 D5 16 A6 AC B3 00 00 00 00 00 00 00 00
21:39:28.1504|DEBUG|Api| Authorization failed!
21:39:28.1525|DEBUG|Api| Api Exception
21:39:28.4569|DEBUG|0| RESEND: RS(first:08/30/2021 18:39:17,last:08/30/2021 18:39:27) => Type: Init1  Flags: [ _ _ _ U ]      Id: 101
  MAC: 54 53 33 49 4E 49 54 31         Header: 00 00 00 00 00
  Data: 5D 65 36 30 00 61 2D 25 D5 16 A6 AC B3 00 00 00 00 00 00 00 00
21:39:29.5536|DEBUG|0| RESEND: RS(first:08/30/2021 18:39:17,last:08/30/2021 18:39:28) => Type: Init1   Flags: [ _ _ _ U ]      Id: 101
  MAC: 54 53 33 49 4E 49 54 31         Header: 00 00 00 00 00
  Data: 5D 65 36 30 00 61 2D 25 D5 16 A6 AC B3 00 00 00 00 00 00 00 00
21:39:29.8014|DEBUG|Api| Authorization failed!
21:39:29.8042|DEBUG|Api| Api Exception
21:39:30.3552|DEBUG|Api| Authorization failed!
21:39:30.3552|DEBUG|Api| Api Exception
21:39:30.6564|DEBUG|0| RESEND: RS(first:08/30/2021 1

**Comment by MissXecutioner** [comment]
[ts3audiobot_2021-08-30_21_48_32.log](https://github.com/Splamy/TS3AudioBot/files/7078867/ts3audiobot_2021-08-30_21_48_32.log)

**Comment by MissXecutioner** [comment]
up

**Comment by MissXecutioner** [comment]
up

**Comment by MissXecutioner** [comment]
update

**Comment by MissXecutioner** [comment]
up
